{
  "schema_version": "1.0",
  "lead_id": "lead-7f3a1c",
  "topic_id": "ownership-registries",
  "direction_id": "ownership",
  "summary": "Northwind Holdings filed its 2025 annual return naming Example Trust as sole shareholder.",
  "subjects": [
    "Northwind Holdings",
    "Example Trust"
  ],
  "absence": false,
  "status": "candidate",
  "stored": "page",
  "capture": {
    "route": "api",
    "tool": "firecrawl",
    "source_url": "https://registry.example.test/companies/0001234/filings/2025",
    "captured_at": "2026-10-23T09:14:02Z"
  },
  "content_ref": "sources/0682c5f2076f099c34cfdd15a9e063849ed437a49677e6fcc5b4198c76575be5.html",
  "content_sha256": "0682c5f2076f099c34cfdd15a9e063849ed437a49677e6fcc5b4198c76575be5",
  "derivatives": [
    {
      "id": "d1",
      "type": "extracted_text",
      "content_ref": "sources/bc18f7068971a44e264848ecd54b72b02d38216abb8ce3c3d2148e37e8a12398.md",
      "content_sha256": "bc18f7068971a44e264848ecd54b72b02d38216abb8ce3c3d2148e37e8a12398"
    }
  ],
  "provenance": {
    "method": "agent_candidate",
    "model": "deepseek/deepseek-v4-flash"
  },
  "excerpt": {
    "text": "Shareholder: Example Trust (100 ordinary shares)",
    "language": "en",
    "direct_quote": true,
    "derivative_id": "d1"
  },
  "attribution": {
    "actor": {
      "label": "Companies Registry"
    },
    "stance": "asserts",
    "attribution_verbatim": "Annual return filed 2025-03-31"
  }
}
